{
  "$schema": "https://json-schema.org/draft/2020-12/schema",
  "$id": "https://cutdown.local/contracts/schemas/master-story-plan-v1.json",
  "title": "MasterStoryPlan",
  "schemaVersion": "1.0.0",
  "description": "The platform-neutral narrative graph for one CreativeBrief (PRD REQ-033): an ordered sequence of narrative-function beats, the dependencies between them, optional beats, and alternate hook hypotheses. Platform-neutral by construction — crop, caption, and duration decisions belong to the PlatformEDL, not here. REQ-033 refuses to force every format into a fixed five-role arc, so `beats` is a free-length ordered list over the narrative-function vocabulary, not a fixed set of slots. Immutable revision (PRD §5). The model proposes the plan; D-37 keeps it advisory — the deterministic 'required context' gate later checks that a payoff beat is not cut loose from the setup it depends on.",
  "changelog": [
    {
      "changedAt": "2026-07-28",
      "changeKind": "breaking",
      "reason": "Initial v1 (Phase 3, tech-spec §15 step 5). Order is carried by array position plus an explicit `order` integer so a reordering revision is a visible diff, not a silent array shuffle. Dependencies reference beats (not Moments) using the same relation vocabulary as Moment.sourceDependencies, so the story graph and the source graph speak one language."
    }
  ],
  "type": "object",
  "additionalProperties": false,
  "required": [
    "storyPlanId",
    "envelope",
    "jobId",
    "creativeBriefId",
    "parentStoryPlanId",
    "beats",
    "dependencies",
    "alternateHooks",
    "modelProvenance"
  ],
  "properties": {
    "storyPlanId": { "$ref": "./common/timecode-v1.json#/$defs/Ulid" },
    "envelope": { "$ref": "./common/envelope-v1.json" },
    "jobId": { "type": "string", "minLength": 1 },
    "creativeBriefId": {
      "$ref": "./common/timecode-v1.json#/$defs/Ulid",
      "description": "The CreativeBrief this plan structures (PRD lineage §3)."
    },
    "parentStoryPlanId": {
      "oneOf": [
        { "$ref": "./common/timecode-v1.json#/$defs/Ulid" },
        { "type": "null" }
      ],
      "description": "The revision this supersedes, or null for the first (REQ-039)."
    },
    "beats": {
      "type": "array",
      "minItems": 1,
      "description": "The ordered narrative sequence (REQ-033). Each beat names a narrative function, the Moment that fills it, and — per REQ-034 — evidence-linked rationale. `optional` marks a beat the edit can drop under a duration constraint; `alternateMomentIds` exposes REQ-040 alternatives for pivotal beats.",
      "items": {
        "title": "StoryBeat",
        "type": "object",
        "additionalProperties": false,
        "required": ["beatId", "order", "function", "momentId", "rationale", "basis", "optional", "alternateMomentIds"],
        "properties": {
          "beatId": {
            "type": "string",
            "minLength": 1,
            "description": "Stable within-plan beat identifier (e.g. `beat-1`), referenced by `dependencies` and `alternateHooks`. Not a ULID: beats are plan-local, not addressable artefacts."
          },
          "order": {
            "type": "integer",
            "minimum": 0,
            "description": "Intended sequence position. Explicit (not just array index) so a reorder is a visible field diff; the plan resolver asserts order values are a contiguous permutation."
          },
          "function": { "$ref": "../enums/narrative-function.json" },
          "momentId": {
            "$ref": "./common/timecode-v1.json#/$defs/Ulid",
            "description": "The Moment that fills this beat. Must be one of the CreativeBrief's selected Moments; the plan resolver checks membership."
          },
          "rationale": { "type": "string", "minLength": 1 },
          "basis": {
            "title": "BeatBasis",
            "description": "REQ-034: distinguish observed fact from model judgement for each structural decision.",
            "type": "object",
            "oneOf": [
              {
                "title": "ObservedFact",
                "type": "object",
                "additionalProperties": false,
                "required": ["kind", "observed"],
                "properties": {
                  "kind": { "type": "string", "const": "observed_fact" },
                  "observed": { "type": "string", "minLength": 1 }
                }
              },
              {
                "title": "ModelJudgement",
                "type": "object",
                "additionalProperties": false,
                "required": ["kind", "inference"],
                "properties": {
                  "kind": { "type": "string", "const": "model_judgement" },
                  "inference": { "type": "string", "minLength": 1 }
                }
              }
            ]
          },
          "optional": {
            "type": "boolean",
            "description": "REQ-033 'optional beats': true if the edit may drop this beat to meet a duration bound without breaking the story."
          },
          "alternateMomentIds": {
            "type": "array",
            "items": { "$ref": "./common/timecode-v1.json#/$defs/Ulid" },
            "description": "REQ-040: plausible source alternatives for this beat, especially for hook/proof/payoff/closing. May be empty when none exist."
          }
        }
      }
    },
    "dependencies": {
      "type": "array",
      "description": "Which beats need which other beats to make sense (REQ-033 dependencies; REQ-018 source dependencies carried up to the story level). The deterministic 'required context' editorial gate (D-37) uses these to refuse an EDL that keeps a payoff but drops its `requires_setup`.",
      "items": {
        "title": "BeatDependency",
        "type": "object",
        "additionalProperties": false,
        "required": ["fromBeatId", "toBeatId", "relation"],
        "properties": {
          "fromBeatId": { "type": "string", "minLength": 1, "description": "The dependent beat." },
          "toBeatId": { "type": "string", "minLength": 1, "description": "The beat it depends on." },
          "relation": {
            "type": "string",
            "enum": ["requires_setup", "answers", "proves", "continues", "contradicts"],
            "description": "Same vocabulary as Moment.sourceDependencies.relation, so story-level and source-level dependencies read alike."
          }
        }
      }
    },
    "alternateHooks": {
      "type": "array",
      "description": "REQ-032 Hook Lab: alternate opening hypotheses over a shared body, each a different `hook-family` bet anchored to a candidate opening beat. Lets the reviewer A/B the opening without re-planning the whole story.",
      "items": {
        "title": "AlternateHook",
        "type": "object",
        "additionalProperties": false,
        "required": ["hookFamily", "openingBeatId", "rationale"],
        "properties": {
          "hookFamily": { "$ref": "../enums/hook-family.json" },
          "openingBeatId": { "type": "string", "minLength": 1, "description": "The beat that would open under this hook hypothesis." },
          "rationale": { "type": "string", "minLength": 1 }
        }
      }
    },
    "modelProvenance": { "$ref": "./common/model-provenance-v1.json" }
  }
}
